{
  "schemaVersion": "chatgpt.browser_control.operation_control_request.v1",
  "controlActionId": "22222222-2222-4222-8222-222222222222",
  "parent": {
    "schemaVersion": "chatgpt.browser_control.operation_handle.v1",
    "operationId": "11111111-1111-4111-8111-111111111111",
    "requestDigest": "hmac-sha256:aaaaaaaaaaaaaaaaaaaaaaaaaaaaaaaaaaaaaaaaaaaaaaaaaaaaaaaaaaaaaaaa",
    "surface": "work",
    "revision": 8,
    "phase": "generating",
    "mutationBoundary": "send_may_have_occurred",
    "targetBindingDigest": "hmac-sha256:bbbbbbbbbbbbbbbbbbbbbbbbbbbbbbbbbbbbbbbbbbbbbbbbbbbbbbbbbbbbbbbb"
  },
  "action": "steer",
  "expectedAssistantTurnId": "assistant-turn-1",
  "steerPrompt": "Continue with the next bounded step.",
  "timeoutMs": 10000
}
